{"$schema":"https://json-schema.org/draft/2020-12/schema","$id":"https://restic-central.invalid/schema/exchanges-v1.json","title":"restic-central échanges JSON v1","description":"DTO publics versionnés. Secrets uniquement par référence; extensions conservées sans exécution.","type":"object","required":["schema_version","message_type","message_id","sent_at","payload"],"properties":{"schema_version":{"type":"integer","const":1},"message_type":{"type":"string","enum":["version.negotiate.request","version.negotiate.response","agent.enroll","agent.enroll.result","heartbeat","config.get.response","job.claim.request","job.claim.response","job.accept","job.cancel","attempt.renew","event.batch","attempt.result","snapshot.reconcile","reconcile.request","reconcile.response","error","page.response","notification.delivery"]},"message_id":{"$ref":"#/$defs/uuid"},"correlation_id":{"$ref":"#/$defs/uuid"},"agent_id":{"$ref":"#/$defs/uuid"},"sent_at":{"$ref":"#/$defs/date-time"},"payload":{"type":"object"},"extensions":{"$ref":"#/$defs/extensions"}},"additionalProperties":false,"allOf":[{"if":{"properties":{"message_type":{"const":"version.negotiate.request"}}},"then":{"properties":{"payload":{"$ref":"#/$defs/version_negotiate_request"}}}},{"if":{"properties":{"message_type":{"const":"version.negotiate.response"}}},"then":{"properties":{"payload":{"$ref":"#/$defs/version_negotiate_response"}}}},{"if":{"properties":{"message_type":{"const":"agent.enroll"}}},"then":{"properties":{"payload":{"$ref":"#/$defs/agent_enroll"}}}},{"if":{"properties":{"message_type":{"const":"agent.enroll.result"}}},"then":{"properties":{"payload":{"$ref":"#/$defs/agent_enroll_result"}}}},{"if":{"properties":{"message_type":{"const":"heartbeat"}}},"then":{"properties":{"payload":{"$ref":"#/$defs/heartbeat"}}}},{"if":{"properties":{"message_type":{"const":"job.claim.request"}}},"then":{"properties":{"payload":{"$ref":"#/$defs/job_claim_request"}}}},{"if":{"properties":{"message_type":{"const":"job.accept"}}},"then":{"properties":{"payload":{"$ref":"#/$defs/job_accept"}}}},{"if":{"properties":{"message_type":{"const":"attempt.result"}}},"then":{"properties":{"payload":{"$ref":"#/$defs/attempt_result"}}}},{"if":{"properties":{"message_type":{"const":"event.batch"}}},"then":{"properties":{"payload":{"$ref":"#/$defs/event_batch"}}}},{"if":{"properties":{"message_type":{"const":"snapshot.reconcile"}}},"then":{"properties":{"payload":{"$ref":"#/$defs/snapshot_reconcile"}}}},{"if":{"properties":{"message_type":{"const":"error"}}},"then":{"properties":{"payload":{"$ref":"#/$defs/error"}}}}],"$defs":{"uuid":{"type":"string","format":"uuid","description":"UUID opaque."},"date-time":{"type":"string","format":"date-time","description":"RFC3339 UTC."},"extensions":{"type":"object","description":"Champs inconnus conservés, bornés, jamais exécutés.","additionalProperties":true},"secret_ref":{"type":"object","required":["source","name"],"properties":{"source":{"type":"string","enum":["env","authorized_command","os_secret_manager","fnox"],"description":"Source autorisée, jamais la valeur."},"name":{"type":"string","minLength":1,"maxLength":256},"command_key":{"type":"string","maxLength":128}},"additionalProperties":false},"version_negotiate_request":{"type":"object","required":["supported_schema_versions","max_message_bytes","agent_id","sent_at"],"properties":{"supported_schema_versions":{"type":"array","items":{"type":"integer","minimum":1},"minItems":1,"maxItems":16},"max_message_bytes":{"type":"integer","minimum":1024,"maximum":104857600},"agent_id":{"$ref":"#/$defs/uuid"},"sent_at":{"$ref":"#/$defs/date-time"},"capabilities":{"type":"array","items":{"type":"string"},"maxItems":256},"extensions":{"$ref":"#/$defs/extensions"}},"additionalProperties":false},"version_negotiate_response":{"type":"object","required":["selected_schema_version","server_supported_schema_versions","sent_at"],"properties":{"selected_schema_version":{"type":"integer","minimum":1},"server_supported_schema_versions":{"type":"array","items":{"type":"integer","minimum":1},"minItems":1,"maxItems":16},"sent_at":{"$ref":"#/$defs/date-time"},"extensions":{"$ref":"#/$defs/extensions"}},"additionalProperties":false},"agent_enroll":{"type":"object","required":["enrollment_token","machine_id","agent_instance_id","agent_version","platform","sent_at"],"properties":{"enrollment_token":{"type":"string","minLength":20,"maxLength":4096,"description":"Secret 12 h, à usage limité, non journalisé."},"machine_id":{"$ref":"#/$defs/uuid"},"agent_instance_id":{"$ref":"#/$defs/uuid"},"agent_version":{"type":"string","minLength":1},"platform":{"const":"linux/amd64"},"restic_version":{"type":"string"},"sent_at":{"$ref":"#/$defs/date-time"},"extensions":{"$ref":"#/$defs/extensions"}},"additionalProperties":false},"agent_enroll_result":{"type":"object","required":["agent_id","credential","expires_at","sent_at"],"properties":{"agent_id":{"$ref":"#/$defs/uuid"},"credential":{"type":"object","required":["kind","value"],"properties":{"kind":{"enum":["bearer_token","mTLS_reference"]},"value":{"type":"string","description":"Secret; hors logs."}},"additionalProperties":false},"expires_at":{"$ref":"#/$defs/date-time"},"sent_at":{"$ref":"#/$defs/date-time"},"extensions":{"$ref":"#/$defs/extensions"}},"additionalProperties":false},"heartbeat":{"type":"object","required":["agent_id","agent_instance_id","observed_at","state","active_attempts","outbox"],"properties":{"agent_id":{"$ref":"#/$defs/uuid"},"agent_instance_id":{"$ref":"#/$defs/uuid"},"observed_at":{"$ref":"#/$defs/date-time"},"state":{"enum":["online","degraded","offline_pending"]},"active_attempts":{"type":"array","items":{"$ref":"#/$defs/active_attempt"},"maxItems":32},"outbox":{"type":"object","required":["pending_count","loss_state"],"properties":{"pending_count":{"type":"integer","minimum":0},"loss_state":{"enum":["none","degraded","outbox_loss"]},"dropped_count":{"type":"integer","minimum":0},"oldest_dropped_at":{"type":["string","null"],"format":"date-time"}},"additionalProperties":false},"extensions":{"$ref":"#/$defs/extensions"}},"additionalProperties":false},"active_attempt":{"type":"object","required":["attempt_id","local_job_uuid","state"],"properties":{"attempt_id":{"$ref":"#/$defs/uuid"},"server_job_id":{"$ref":"#/$defs/uuid"},"local_job_uuid":{"$ref":"#/$defs/uuid"},"state":{"$ref":"#/$defs/status"},"started_at":{"$ref":"#/$defs/date-time"}},"additionalProperties":false},"status":{"enum":["received","accepted","running","succeeded","partial","failed","unknown","degraded","expired","canceled","cancel_requested","blocked_unknown_scope","persistence_failed"]},"job_fields":{"type":"object","required":["server_job_id","local_job_uuid","machine_id","profile_id","job_type","origin","state","scheduled_at","expires_at","config_revision_id"],"properties":{"server_job_id":{"$ref":"#/$defs/uuid"},"local_job_uuid":{"$ref":"#/$defs/uuid"},"machine_id":{"$ref":"#/$defs/uuid"},"profile_id":{"$ref":"#/$defs/uuid"},"job_type":{"enum":["backup","copy","forget","prune","check","stats"]},"origin":{"enum":["server_schedule","operator","local_manual","cached_maintenance"]},"state":{"$ref":"#/$defs/status"},"scheduled_at":{"$ref":"#/$defs/date-time"},"expires_at":{"$ref":"#/$defs/date-time"},"config_revision_id":{"$ref":"#/$defs/uuid"},"target_repository_id":{"$ref":"#/$defs/uuid"},"extensions":{"$ref":"#/$defs/extensions"}},"additionalProperties":false},"job_claim_request":{"type":"object","required":["agent_id","available_slots","sent_at"],"properties":{"agent_id":{"$ref":"#/$defs/uuid"},"available_slots":{"const":1},"sent_at":{"$ref":"#/$defs/date-time"},"known_server_job_ids":{"type":"array","items":{"$ref":"#/$defs/uuid"},"maxItems":1000},"extensions":{"$ref":"#/$defs/extensions"}},"additionalProperties":false},"job_accept":{"type":"object","required":["server_job_id","local_job_uuid","attempt_id","accepted_at","expires_at"],"properties":{"server_job_id":{"$ref":"#/$defs/uuid"},"local_job_uuid":{"$ref":"#/$defs/uuid"},"attempt_id":{"$ref":"#/$defs/uuid"},"accepted_at":{"$ref":"#/$defs/date-time"},"expires_at":{"$ref":"#/$defs/date-time"},"config_revision_id":{"$ref":"#/$defs/uuid"},"extensions":{"$ref":"#/$defs/extensions"}},"additionalProperties":false},"event":{"type":"object","required":["event_id","attempt_id","sequence_number","occurred_at","event_type","payload"],"properties":{"event_id":{"$ref":"#/$defs/uuid"},"attempt_id":{"$ref":"#/$defs/uuid"},"sequence_number":{"type":"integer","minimum":1},"occurred_at":{"$ref":"#/$defs/date-time"},"event_type":{"type":"string","pattern":"^[a-z][a-z0-9_.-]{1,127}$"},"payload":{"type":"object","additionalProperties":true},"extensions":{"$ref":"#/$defs/extensions"}},"additionalProperties":false},"event_batch":{"type":"object","required":["attempt_id","events"],"properties":{"attempt_id":{"$ref":"#/$defs/uuid"},"events":{"type":"array","items":{"$ref":"#/$defs/event"},"minItems":1,"maxItems":1000},"extensions":{"$ref":"#/$defs/extensions"}},"additionalProperties":false},"step_result":{"type":"object","required":["step_id","step_type","status","started_at","finished_at"],"properties":{"step_id":{"type":"string","minLength":1},"step_type":{"enum":["pre_hook","backup","copy","post_hook","forget","prune","check","stats"]},"status":{"$ref":"#/$defs/status"},"started_at":{"$ref":"#/$defs/date-time"},"finished_at":{"$ref":"#/$defs/date-time"},"exit_code":{"type":"integer"},"repository_id":{"$ref":"#/$defs/uuid"},"source_snapshot_id":{"type":"string"},"destination_snapshot_id":{"type":"string"},"error":{"type":"object","required":["code","message","retryable"],"properties":{"code":{"type":"string"},"message":{"type":"string","maxLength":2000},"retryable":{"type":"boolean"}},"additionalProperties":false},"metrics":{"type":"object","additionalProperties":true}},"additionalProperties":false},"attempt_result":{"type":"object","required":["attempt_id","server_job_id","local_job_uuid","status","started_at","finished_at","steps","idempotency_key"],"properties":{"attempt_id":{"$ref":"#/$defs/uuid"},"server_job_id":{"$ref":"#/$defs/uuid"},"local_job_uuid":{"$ref":"#/$defs/uuid"},"status":{"$ref":"#/$defs/status"},"started_at":{"$ref":"#/$defs/date-time"},"finished_at":{"$ref":"#/$defs/date-time"},"steps":{"type":"array","items":{"$ref":"#/$defs/step_result"},"minItems":1,"maxItems":10000},"idempotency_key":{"type":"string","minLength":1},"snapshot":{"type":"object","properties":{"repository_id":{"$ref":"#/$defs/uuid"},"restic_snapshot_id":{"type":"string","pattern":"^[0-9a-f]{8,64}$"},"provenance":{"enum":["created","reused","replicated","observed_unknown"]}},"required":["repository_id","restic_snapshot_id","provenance"],"additionalProperties":false},"restic_json":{"type":"object","description":"Payload Restic préservé, imbriqué et borné."},"extensions":{"$ref":"#/$defs/extensions"}},"additionalProperties":false},"snapshot_reconcile":{"type":"object","required":["repository_id","observed_at","mode","snapshots"],"properties":{"repository_id":{"$ref":"#/$defs/uuid"},"machine_id":{"$ref":"#/$defs/uuid"},"observed_at":{"$ref":"#/$defs/date-time"},"mode":{"enum":["full","incremental"]},"snapshots":{"type":"array","items":{"type":"object","required":["restic_snapshot_id","observed_at","provenance"],"properties":{"restic_snapshot_id":{"type":"string","pattern":"^[0-9a-f]{8,64}$"},"observed_at":{"$ref":"#/$defs/date-time"},"provenance":{"enum":["created","reused","replicated","observed_unknown"]},"source_snapshot_id":{"type":"string"}},"additionalProperties":false},"maxItems":100000},"extensions":{"$ref":"#/$defs/extensions"}},"additionalProperties":false},"error":{"type":"object","required":["code","message","retryable","request_id"],"properties":{"code":{"type":"string"},"message":{"type":"string","maxLength":2000},"retryable":{"type":"boolean"},"request_id":{"$ref":"#/$defs/uuid"},"retry_after_seconds":{"type":"integer","minimum":0},"details":{"type":"object","additionalProperties":true},"extensions":{"$ref":"#/$defs/extensions"}},"additionalProperties":false}}}
