{
  "schema_version": 1,
  "message_id": "11111111-1111-4111-8111-111111111111",
  "sent_at": "2026-10-21T12:00:00Z",
  "payload": {
    "agent_id": "11111111-1111-4111-8111-111111111111",
    "agent_instance_id": "11111111-1111-4111-8111-111111111111",
    "observed_at": "2026-10-21T12:00:00Z",
    "state": "online",
    "active_attempts": [],
    "outbox": {
      "pending_count": 0,
      "oldest_pending_at": null,
      "loss_state": "none"
    }
  },
  "message_type": "heartbeat"
}
