{
  "schema_version": 1,
  "message_id": "11111111-1111-4111-8111-111111111111",
  "sent_at": "2026-10-21T12:00:00Z",
  "payload": {
    "attempt_id": "11111111-1111-4111-8111-111111111111",
    "server_job_id": "11111111-1111-4111-8111-111111111111",
    "lease_id": "11111111-1111-4111-8111-111111111111",
    "renewed_at": "2026-10-21T12:00:00Z",
    "lease_expires_at": "2026-10-21T12:00:00Z"
  },
  "message_type": "attempt.renew"
}
