{
  "schema_version": 1,
  "message_id": "11111111-1111-4111-8111-111111111111",
  "sent_at": "2026-10-21T12:00:00Z",
  "payload": {
    "enrollment_token": "example-enrollment-token-2026",
    "machine_id": "11111111-1111-4111-8111-111111111111",
    "agent_instance_id": "11111111-1111-4111-8111-111111111111",
    "agent_version": "example",
    "platform": "linux/amd64",
    "sent_at": "2026-10-21T12:00:00Z"
  },
  "message_type": "agent.enroll"
}
