{
  "schema_version": 1,
  "message_type": "attempt.result",
  "message_id": "11111111-1111-4111-8111-111111111111",
  "correlation_id": "22222222-2222-4222-8222-222222222222",
  "agent_id": "33333333-3333-4333-8333-333333333333",
  "sent_at": "2026-10-21T12:00:00Z",
  "payload": {
    "attempt_id": "44444444-4444-4444-8444-444444444444",
    "server_job_id": "55555555-5555-4555-8555-555555555555",
    "local_job_uuid": "66666666-6666-4666-8666-666666666666",
    "status": "partial",
    "started_at": "2026-10-21T11:00:00Z",
    "finished_at": "2026-10-21T11:20:00Z",
    "idempotency_key": "attempt:44444444-4444-4444-8444-444444444444:result",
    "steps": [
      {
        "step_id": "backup",
        "step_type": "backup",
        "status": "succeeded",
        "started_at": "2026-10-21T11:01:00Z",
        "finished_at": "2026-10-21T11:10:00Z"
      },
      {
        "step_id": "copy-primary-replica",
        "step_type": "copy",
        "status": "failed",
        "started_at": "2026-10-21T11:11:00Z",
        "finished_at": "2026-10-21T11:20:00Z",
        "error": {
          "code": "destination_unreachable",
          "message": "Repository destination unreachable",
          "retryable": true
        }
      }
    ]
  }
}
